{"schema_version":1,"workspace_id":"ws_alpha","scope":{"kind":"project","project_id":"proj"},"capability_set_id":"caps_one","revision":"r1","capabilities":[{"capability":"native_session_binding","quality":"authoritative","constraints":{"access_mode":"observe_only","filesystem_roots":["/srv/workspaces/repos/app"],"network_access":false,"tool_ids":[]},"evidence":{"evidence_kind":"profile_attestation","source_id":"native_adapter","source_revision":"r1","integrity":"sha256:bbbbbbbbbbbbbbbbbbbbbbbbbbbbbbbbbbbbbbbbbbbbbbbbbbbbbbbbbbbbbbbb"}},{"capability":"native_delivery","quality":"authoritative","constraints":{"access_mode":"observe_only","filesystem_roots":["/srv/workspaces/repos/app"],"network_access":false,"tool_ids":[]},"evidence":{"evidence_kind":"profile_attestation","source_id":"native_adapter","source_revision":"r1","integrity":"sha256:aaaaaaaaaaaaaaaaaaaaaaaaaaaaaaaaaaaaaaaaaaaaaaaaaaaaaaaaaaaaaaaa"}},{"capability":"ui_visibility","quality":"best_effort","constraints":{"access_mode":"observe_only"},"evidence":{"evidence_kind":"adapter_attestation","source_id":"native_adapter","source_revision":"r1","integrity":"sha256:cccccccccccccccccccccccccccccccccccccccccccccccccccccccccccccccc"}},{"capability":"remote_send","quality":"unsupported"}]}
